{
  "$schema": "http://json-schema.org/draft-07/schema#",
  "title": "OWASP GenAI Crosswalk Entry",
  "description": "Schema for mapping OWASP GenAI vulnerabilities to security frameworks",
  "type": "object",
  "required": ["id", "name", "source_list", "severity", "mappings"],
  "properties": {
    "id": {
      "type": "string",
      "description": "Vulnerability identifier e.g. LLM01, ASI03, DSGAI07",
      "pattern": "^(LLM\\d{2}|ASI\\d{2}|DSGAI\\d{2})$"
    },
    "name": {
      "type": "string",
      "description": "Short human-readable name e.g. Prompt Injection"
    },
    "source_list": {
      "type": "string",
      "enum": ["LLM-Top10-2025", "Agentic-Top10-2026", "DSGAI-2026"],
      "description": "Which OWASP list this entry belongs to"
    },
    "version": {
      "type": "string",
      "description": "Mapping version e.g. 2026-Q1"
    },
    "severity": {
      "type": "string",
      "enum": ["Critical", "High", "Medium", "Low"],
      "description": "Standardised severity aligned to AIVSS"
    },
    "aivss_score": {
      "type": ["number", "null"],
      "minimum": 0,
      "maximum": 10,
      "description": "OWASP AIVSS score where available"
    },
    "audience": {
      "type": "array",
      "items": {
        "type": "string",
        "enum": [
          "developer", "security-engineer", "auditor",
          "ciso", "red-teamer", "data-engineer",
          "ml-engineer", "ot-engineer", "compliance"
        ]
      }
    },
    "mappings": {
      "type": "array",
      "description": "One entry per framework control",
      "items": {
        "type": "object",
        "required": ["framework", "control_id", "control_name", "tier", "scope"],
        "properties": {
          "framework": {
            "type": "string",
            "description": "Framework identifier e.g. MITRE-ATLAS, ISO-42001, AIUC-1"
          },
          "control_id": {
            "type": "string",
            "description": "Control or clause ID within the framework"
          },
          "control_name": {
            "type": "string",
            "description": "Human-readable control name"
          },
          "url": {
            "type": "string",
            "format": "uri",
            "description": "Direct link to the control"
          },
          "tier": {
            "type": "string",
            "enum": ["Foundational", "Hardening", "Advanced"],
            "description": "Implementation maturity tier"
          },
          "scope": {
            "type": "string",
            "enum": ["Buy", "Build", "Both"],
            "description": "Whether this is addressed by vendor capability, internal engineering, or both"
          },
          "notes": {
            "type": "string",
            "description": "Optional implementation notes"
          }
        }
      }
    },
    "tools": {
      "type": "array",
      "items": {
        "type": "object",
        "properties": {
          "name": { "type": "string" },
          "url": { "type": "string", "format": "uri" },
          "type": { "type": "string", "enum": ["open-source", "commercial", "both"] }
        }
      }
    },
    "incidents": {
      "type": "array",
      "description": "Known real-world incidents referencing this vulnerability",
      "items": {
        "type": "object",
        "properties": {
          "name": { "type": "string" },
          "url": { "type": "string", "format": "uri" },
          "year": { "type": "integer" }
        }
      }
    },
    "crossrefs": {
      "type": "object",
      "description": "Links to related entries in other OWASP lists",
      "properties": {
        "llm_top10": { "type": "array", "items": { "type": "string" } },
        "agentic_top10": { "type": "array", "items": { "type": "string" } },
        "dsgai_2026": { "type": "array", "items": { "type": "string" } }
      }
    },
    "changelog": {
      "type": "array",
      "items": {
        "type": "object",
        "properties": {
          "date": { "type": "string", "format": "date" },
          "version": { "type": "string" },
          "change": { "type": "string" },
          "author": { "type": "string" }
        }
      }
    }
  }
}
