{
  "id": "LLM08",
  "name": "Vector and Embedding Weaknesses",
  "source_list": "LLM-Top10-2025",
  "version": "2026-Q1",
  "severity": "Medium",
  "aivss_score": null,
  "audience": [
    "red-teamer",
    "security-engineer",
    "developer",
    "ml-engineer",
    "ot-engineer",
    "ciso",
    "compliance",
    "auditor"
  ],
  "mappings": [
    {
      "framework": "MITRE ATLAS",
      "control_id": "AML.T0063",
      "control_name": "Embedding Manipulation",
      "tier": "Hardening",
      "scope": "Build",
      "url": "https://atlas.mitre.org/techniques/AML.T0063",
      "notes": "Crafting inputs whose embeddings manipulate similarity search results"
    },
    {
      "framework": "MITRE ATLAS",
      "control_id": "AML.T0025",
      "control_name": "Resource Exhaustion via Embedding",
      "tier": "Hardening",
      "scope": "Build",
      "url": "https://atlas.mitre.org/techniques/AML.T0025",
      "notes": "Flooding vector stores with adversarial embeddings to degrade retrieval quality"
    },
    {
      "framework": "NIST AI RMF 1.0",
      "control_id": "MS-2.5",
      "control_name": "Testing — adversarial",
      "tier": "Hardening",
      "scope": "Build",
      "notes": "Vector store and embedding adversarial testing included in evaluation programme"
    },
    {
      "framework": "NIST AI RMF 1.0",
      "control_id": "MS-3.3",
      "control_name": "Data quality",
      "tier": "Hardening",
      "scope": "Build",
      "notes": "Data quality controls applied to embedding generation and vector store ingestion"
    },
    {
      "framework": "NIST AI RMF 1.0",
      "control_id": "MG-2.2",
      "control_name": "Risk response",
      "tier": "Hardening",
      "scope": "Build",
      "notes": "Response procedures for detected vector store compromise or manipulation"
    },
    {
      "framework": "NIST AI RMF 1.0",
      "control_id": "MP-2.3",
      "control_name": "Risk categorisation",
      "tier": "Hardening",
      "scope": "Build",
      "notes": "Embedding and vector store risks mapped in AI system risk register"
    },
    {
      "framework": "EU AI Act",
      "control_id": "Embedding and retrieval risks identified and mitigated",
      "control_name": "Art. 9 — Risk management",
      "tier": "Hardening",
      "scope": "Both",
      "notes": "Vector store attack scenarios included in risk management system"
    },
    {
      "framework": "EU AI Act",
      "control_id": "Data quality controls applied to all data in scope — including RAG corpora",
      "control_name": "Art. 10 — Data and data governance",
      "tier": "Hardening",
      "scope": "Both",
      "notes": "Quality controls on embedding generation and vector store ingestion required"
    },
    {
      "framework": "EU AI Act",
      "control_id": "Technical robustness against adversarial manipulation",
      "control_name": "Art. 15 — Accuracy, robustness, cybersecurity",
      "tier": "Hardening",
      "scope": "Both",
      "notes": "Embedding manipulation resistance is an Art. 15 technical requirement"
    },
    {
      "framework": "ISO/IEC 27001:2022",
      "control_id": "A.8.3",
      "control_name": "Information access restriction",
      "tier": "Hardening",
      "scope": "Build",
      "notes": "RBAC on all vector store collections — no unauthenticated access to any collection"
    },
    {
      "framework": "ISO/IEC 27001:2022",
      "control_id": "A.8.24",
      "control_name": "Use of cryptography",
      "tier": "Hardening",
      "scope": "Build",
      "notes": "Encryption of all vector store data at rest and in transit"
    },
    {
      "framework": "ISO/IEC 27001:2022",
      "control_id": "A.8.16",
      "control_name": "Monitoring activities",
      "tier": "Hardening",
      "scope": "Build",
      "notes": "Anomaly detection on vector store query patterns — bulk extraction and poisoning indicators"
    },
    {
      "framework": "ISO/IEC 27001:2022",
      "control_id": "A.8.11",
      "control_name": "Data masking",
      "tier": "Hardening",
      "scope": "Build",
      "notes": "Differential privacy in embedding generation for sensitive corpora"
    },
    {
      "framework": "ISO/IEC 42001:2023",
      "control_id": "A.7.2",
      "control_name": "Data quality",
      "tier": "Hardening",
      "scope": "Both",
      "notes": "Vector store content quality requirements — RBAC, encryption, source validation as data quality controls"
    },
    {
      "framework": "ISO/IEC 42001:2023",
      "control_id": "A.7.3",
      "control_name": "Data provenance and characteristics",
      "tier": "Hardening",
      "scope": "Both",
      "notes": "Embedding provenance documented — source document, classification, access controls tracked"
    },
    {
      "framework": "ISO/IEC 42001:2023",
      "control_id": "A.6.2.6",
      "control_name": "Testing of AI systems",
      "tier": "Hardening",
      "scope": "Both",
      "notes": "Vector store attacks in AIMS testing — RBAC bypass, embedding inversion, bulk extraction tested"
    },
    {
      "framework": "ISO/IEC 42001:2023",
      "control_id": "A.10.1",
      "control_name": "Third-party AI system acquisition",
      "tier": "Hardening",
      "scope": "Both",
      "notes": "Vector database providers assessed as third-party AI system components"
    },
    {
      "framework": "CIS Controls v8.1",
      "control_id": "3.11 Encrypt sensitive data at rest",
      "control_name": "CIS 3 — Data Protection",
      "tier": "Hardening",
      "scope": "Both",
      "notes": "All vector store content encrypted at rest"
    },
    {
      "framework": "CIS Controls v8.1",
      "control_id": "7.1 Establish vulnerability management",
      "control_name": "CIS 7 — Vulnerability Management",
      "tier": "Hardening",
      "scope": "Both",
      "notes": "Vector database CVEs in vulnerability management process — CVE-2024-3584 and equivalents"
    },
    {
      "framework": "CIS Controls v8.1",
      "control_id": "16.1 Establish secure development standards",
      "control_name": "CIS 16 — Application Software Security",
      "tier": "Hardening",
      "scope": "Both",
      "notes": "Secure coding requirements for vector store integration — RBAC, encryption, input validation"
    },
    {
      "framework": "OWASP ASVS 4.0.3",
      "control_id": "V4.1.3",
      "control_name": "Verify least privilege access control on data",
      "tier": "Hardening",
      "scope": "Both",
      "notes": "RBAC on all vector store collections — no unauthenticated access"
    },
    {
      "framework": "OWASP ASVS 4.0.3",
      "control_id": "V6.1.1",
      "control_name": "Verify all sensitive data encrypted at rest",
      "tier": "Hardening",
      "scope": "Both",
      "notes": "All vector store content encrypted at rest"
    },
    {
      "framework": "OWASP ASVS 4.0.3",
      "control_id": "V12.1.1",
      "control_name": "Verify file upload malware scanning",
      "tier": "Hardening",
      "scope": "Both",
      "notes": "Content validation on all vector store ingestion — adversarial content detected"
    },
    {
      "framework": "ISA/IEC 62443",
      "control_id": "SR 3.7",
      "control_name": "Software and information integrity (monitoring)",
      "tier": "Hardening",
      "scope": "Both",
      "notes": "Vector store content integrity monitored — alert on anomalous retrieval patterns"
    },
    {
      "framework": "ISA/IEC 62443",
      "control_id": "SR 4.3",
      "control_name": "Data confidentiality",
      "tier": "Hardening",
      "scope": "Both",
      "notes": "Embeddings of sensitive OT documentation encrypted — inversion attack protection"
    },
    {
      "framework": "ISA/IEC 62443",
      "control_id": "SR 3.3",
      "control_name": "Software and information integrity",
      "tier": "Hardening",
      "scope": "Both",
      "notes": "Vector store ingestion validated — only authorised OT documentation enters the corpus"
    },
    {
      "framework": "NIST SP 800-82 Rev 3",
      "control_id": "Attacks targeting the integrity of OT decision-support data",
      "control_name": "Section 5.3 — Integrity threats",
      "tier": "Hardening",
      "scope": "Both",
      "notes": "Vector store poisoning as an integrity attack on LLM knowledge sources"
    },
    {
      "framework": "NIST SP 800-82 Rev 3",
      "control_id": "Assess integrity risks for all OT-connected systems",
      "control_name": "Section 6.2 — Risk assessment",
      "tier": "Hardening",
      "scope": "Both",
      "notes": "Vector store integrity included in OT LLM risk assessment"
    },
    {
      "framework": "NIST SP 800-82 Rev 3",
      "control_id": "Title",
      "control_name": "Control",
      "tier": "Hardening",
      "scope": "Both",
      "notes": "Application"
    },
    {
      "framework": "NIST SP 800-82 Rev 3",
      "control_id": "Software, Firmware, and Information Integrity",
      "control_name": "SI-7",
      "tier": "Hardening",
      "scope": "Both",
      "notes": "Vector store integrity monitoring — alert on anomalous content or unexpected modifications"
    },
    {
      "framework": "NIST SP 800-82 Rev 3",
      "control_id": "Protection of Information at Rest",
      "control_name": "SC-28",
      "tier": "Hardening",
      "scope": "Both",
      "notes": "OT vector store content encrypted at rest"
    },
    {
      "framework": "NIST SP 800-82 Rev 3",
      "control_id": "Access Enforcement",
      "control_name": "AC-3",
      "tier": "Hardening",
      "scope": "Both",
      "notes": "Access controls on OT vector stores — RBAC enforced at collection level"
    },
    {
      "framework": "NIST CSF 2.0",
      "control_id": "PR.DS-01",
      "control_name": "Data Security",
      "tier": "Hardening",
      "scope": "Both",
      "notes": "Vector store content encrypted at rest — embeddings treated as sensitive derived data"
    },
    {
      "framework": "NIST CSF 2.0",